{
  "schema_version": "0.1",
  "metadata": {
    "id": "match3-reference",
    "version": "0.1.0"
  },
  "design": {
    "archetype": "match3",
    "audience": {
      "type": "casual"
    },
    "session": {
      "target_minutes": {
        "min": 2,
        "max": 5
      }
    },
    "pillars": [
      "readable_rules",
      "meaningful_decisions"
    ],
    "complexity": {
      "action_budget": "low",
      "mechanic_budget": "medium"
    },
    "content_target": {
      "type": "challenge",
      "expected_count": 1
    }
  },
  "game": {
    "archetype": "match3"
  },
  "runtime": {
    "simulation_mode": "EVENT_DRIVEN",
    "tick_rate": 60
  },
  "action_space": {
    "type": "composite",
    "fields": {
      "type": {
        "type": "discrete",
        "values": [
          "SWAP"
        ]
      },
      "from": {
        "type": "multi_discrete",
        "values": [
          [
            0,
            1,
            2,
            3,
            4
          ],
          [
            0,
            1,
            2,
            3,
            4
          ]
        ]
      },
      "to": {
        "type": "multi_discrete",
        "values": [
          [
            0,
            1,
            2,
            3,
            4
          ],
          [
            0,
            1,
            2,
            3,
            4
          ]
        ]
      }
    }
  },
  "observation": {
    "mode": "VISIBLE_STATE",
    "delay_ms": 0,
    "noise": null
  },
  "rng": {
    "enabled": true
  },
  "content": {
    "id": "match3-challenge-001",
    "type": "challenge",
    "archetype": "match3",
    "parameters": {},
    "objectives": [],
    "dependencies": [],
    "extensions": {
      "match3": {
        "width": 5,
        "height": 5,
        "colors": 4,
        "moves": 15,
        "pointsPerGem": 10,
        "maxCascades": 64,
        "objectives": [
          {
            "type": "score",
            "target": 350
          }
        ],
        "board": [
          [
            0,
            1,
            0,
            2,
            3
          ],
          [
            1,
            0,
            2,
            3,
            0
          ],
          [
            2,
            0,
            1,
            0,
            2
          ],
          [
            3,
            2,
            0,
            1,
            3
          ],
          [
            0,
            3,
            2,
            3,
            1
          ]
        ]
      }
    }
  },
  "evaluation": {
    "player_profiles": [
      {
        "id": "random",
        "version": "0.1.0"
      },
      {
        "id": "greedy",
        "version": "0.1.0"
      },
      {
        "id": "objective_greedy",
        "version": "0.1.0"
      },
      {
        "id": "short_planner",
        "version": "0.1.0"
      },
      {
        "id": "objective_planner",
        "version": "0.1.0"
      }
    ],
    "metrics": [
      "completion_rate",
      "moves_remaining",
      "objective_progress_per_move",
      "cascade_variance",
      "legal_move_count"
    ],
    "gates": [
      "schema",
      "runtime",
      "replay"
    ],
    "seed_set": {
      "mode": "fixed",
      "values": [
        1,
        2,
        3,
        4,
        5
      ]
    }
  },
  "provenance": {
    "rules_version": "match3_v0.1",
    "assumptions": []
  },
  "adapter": {
    "id": "web",
    "version": "0.1"
  },
  "extensions": {}
}
